id,Target_Index,ANVITA,GPT4-5shot,HW-TSC,IOL_Research,Lan-BridgeMT,NLLB_Greedy,NLLB_MBR_BLEU,ONLINE-A,ONLINE-B,ONLINE-G,ONLINE-M,ONLINE-W,ONLINE-Y,refA,synthetic_ref,Yishu,ZengHuiMT
37,1893,"Most of the bolt holes are misaligned, the bolt is laborious, the quality of the machining is poor, and it is not known how long it can be played, because it is promised to the child, and it will not be returned.","Most of the bolt holes did not align, and it was difficult to screw in the top bolt, indicating poor manufacturing quality. It's uncertain how long it can be used, but since it was a promise made to the child, it won't be returned.","Most of the bolt holes are not aligned, and it is very laborious to install the bolts. It can be seen that the processing quality is not good, and I don't know how long it can be played, because it is something promised to the child, so it will not be returned.","Most of the bolt holes are not aligned, on the bolt is very laborious, visible processing quality is not good, do not know how long you can play, because it is a promise to the child, it will not return.","Most of the bolt holes are not aligned, it's very hard to screw in the bolts, which shows the poor processing quality. I don't know how long it can be played with. Since it's something promised to the child, I won't return it.","The bolt holes are mostly out of alignment, the top bolt is very difficult, the quality of the workmanship is not good, and you don't know how long you can play, because it is what you promised the child, and it does not go back.","Most of the bolt holes are not aligned, the top bolt is difficult, and the quality of the workmanship is not good, and it is not known how long you can play, because it is not the same as what you promised the child.","Most of the bolt holes are not aligned, the upper bolt is very difficult, it can be seen that the processing quality is not good, and I don't know how long I can play, because it is something promised to the child, and it will not be returned.","Most of the bolt holes are not aligned, and it is very laborious to install the bolts. It can be seen that the processing quality is not good, and I don’t know how long it can be played, because it is something promised to the child, so it will not be returned.","Most of the bolt holes are not aligned, and the bolts are very strenuous. It can be seen that the processing quality is not good, and I don't know how long I can play, because it is something promised to the child, and it will not be returned.","Most of the bolt holes are not aligned, the bolts are very laborious, visible that the processing quality is not good, and do not know how long you can play, because it is promised to the child something, will not retreat.","Most of the bolt holes don't line up and it's a struggle to get the bolts on, so you can see the poor quality of the machining, and I don't know how long you can play with it, because it's something that was promised to a child, and I won't return it.","Most of the bolt holes aren't aligned. It's very hard to get the bolt on. You can see that the processing quality is not good, and I don't know how long I can play, because it's something I promised my kids, so it won't go back.","The majority of the bolt holes are out of alignment, making it difficult to put the bolts, the processing quality is poor, as can be observed, and I'm not sure how long it can be played, it will not be returned because the child was promised it in the first place.","Most of the bolt holes are not aligned, it's very hard to screw in the bolts, which shows the poor processing quality. I don't know how long it can be played with. Since it's something promised to the child, I won't return it.","Most of the bolt holes are not aligned, and it is very laborious to install the bolts. It can be seen that the processing quality is not good, and I don’t know how long it can be played, because it is something promised to the child, so it will not be returned.","Most of the bolt holes are not aligned, the bolt is very difficult, it can be seen that the processing quality is not good, and I do not know how long I can play, because it is something promised to the child, it will not be returned."
38,1640,"The outside of the pot does not feel any heat, so it is not necessary to heat the pot to prevent it from spreading.","The outside of the pot does not feel hot to the touch, ensuring it won't burn anyone and effectively preventing heat from escaping.","There is no trace of heat on the outside of the pot, even if you are not afraid of being scalded, it can effectively protect the temperature from escaping.","The outside of the pot can not feel a trace of heat, that is not afraid of hot people can also effectively protect the temperature does not dissipate.","The outside of the pot doesn't feel hot at all, so it's not only safe from burns but also effectively keeps the temperature from dissipating.","The outer surface of the pump does not absorb any heat, which means that it can effectively protect the temperature without being exposed to the heat.","The outside of the coating cannot be heated, so it can effectively protect the surface from the heat, regardless of the heat.","The outside of the pot can not feel a trace of heat, that is, it is not afraid of scalding people, and it can effectively protect the temperature from dispersion.","There is no trace of heat on the outside of the pot, even if you are not afraid of being scalded, it can effectively protect the temperature from escaping.","There is not a trace of heat on the outside of the pot, which can effectively protect the temperature from spreading even if it is not afraid of being scalded.","The outside of the pot can not touch a trace of heat, that is, not afraid to burn to people can also effectively protect the temperature from dissipation.","The outside of the pot can not feel a trace of heat, that is, not afraid of scalding people can also effectively protect the temperature does not spread.","The outside of the pot doesn't touch a hint of heat, so even if you're not afraid of getting burned, it can effectively protect the temperature from scattering.","Even if you are not concerned about getting burned, there is no sign of heat on the outside of the pot, which successfully keeps the heat from escaping.","Even if you are not concerned about getting burned, there is no sign of heat on the outside of the pot, which successfully keeps the heat from escaping.","There is no trace of heat on the outside of the pot, even if you are not afraid of being scalded, it can effectively protect the temperature from escaping.","There is no trace of heat on the outside of the pot, that is, it can effectively protect the temperature from being scalded."
39,1742,I was amazed that the sound quality was 3D!,"I was astonished, the sound quality was actually 3D surround!","I was shocked, the sound quality turned out to be surround 3D!",I was amazed that the sound quality was surround 3D!,"I was astonished, the sound quality was actually 3D surround!",I was amazed that the sound was surrounded by 3D!,I was shocked to hear that the sound was surrounded by 3D!,I was shocked that the sound quality turned out to be surround 3D!,"I was shocked, the sound quality turned out to be surround 3D!","I was shocked, the sound quality turned out to be surround 3D stereo!",I was amazed that the sound was in 3D!,I was stunned that the sound quality was even surround 3D!,I was stunned; the sound quality was 3D surround!,I was astounded to discover that the sound quality was surround 3D!,I was amazed that the sound quality was even surround 3D stereo.,"I was shocked, the sound quality turned out to be surround 3D!",I was amazed that the sound quality was even surround 3D stereo.
40,487,"European Union Summit on Refugee Policy Debate, EU Officials: Bottlenecks in the Acceptance Process - China.com","EU summit debates refugee policy, EU official: reception process bottlenecked - China News Network.","EU summit debates on refugee policy, EU officials: bottlenecks in the admission process-Chinanews.com","EU summit to debate refugee policy, EU officials: Reception process step by step bottleneck - China News","EU Summit Argues Over Refugee Policy, EU Official: Bottlenecks at Every Step of the Reception Process - China News Network",EU officials: Reception process is a bottleneck - China News Network,"EU summit debates on refugee policy, EU officials: Reception process is at a standstill","EU summit debates refugee policy, EU officials: step-by-step bottleneck in the reception process - Chinanews.com","EU summit debates on refugee policy, EU officials: bottlenecks in the admission process-Chinanews.com","The EU summit is in a difficult policy debate, EU officials: The receiving process is a bottleneck step by step- <url>","EU summit for refugee policy debate, EU officials: reception process step by step bottlenecks","EU summit argues over refugee policy, EU official: reception process bottlenecks at every step - CNN.com","EU summit debates refugee policy, EU officials: The acceptance process is a bottleneck step by step. -Xinhua","EU faces admission obstacles in refugee policy talks, says Chinanews com","EU Summit Argues Over Refugee Policy, EU Official: Bottlenecks at Every Step of the Reception Process - China News Network","EU summit debates on refugee policy, EU officials: bottlenecks in the admission process-Chinanews.com","EU Summit Debates on Refugee Policy, EU officials Debate on Refugee Policy. Reception process bottlenecks - Chinanews.com."
41,1545,What Is The National Debt Limit,Where is the product's anti-counterfeit label?,Where is the product anti-counterfeiting mark,Where is the product security mark,Where is the product's anti-counterfeit label?,Where is the anti-counterfeiting logo?,Where is the anti-counterfeiting logo?,Where is the product security mark,Where is the product anti-counterfeiting mark,Where is the anti-counterfeiting mark of the product?,Where is the anti-counterfeiting product?,Where is the product security marking,Where is the product security label,Where is the security seal for the product,Where is the product's anti-counterfeit label?,Where is the product anti-counterfeiting mark,Where is the product anti-counterfeiting label?
42,494,"But diplomats from some member states say that if the EU could share the cost of installing cameras, watchtowers, and other infrastructure along the external border, it would free up national budgets and thus speed up the construction process.","However, diplomats from some member countries said that if Europe could share the cost of installing cameras, watchtowers, and other infrastructure along the external borders, it would free up national budgets and speed up the construction process.","But diplomats in some member states said if the EU shared the cost of installing cameras, watchtowers and other infrastructure along its external borders, it would free up national budgets and speed up the process.","But diplomats from some member states say that if the EU could share the cost of installing cameras, watchtowers and other infrastructure along its external borders, it would free up national budgets to speed up the construction process.","But some member states' diplomats said that if the EU could share part of the cost of installing cameras, watchtowers, and other infrastructure along the external border, it would free up national budgets and speed up the construction process.","But diplomats from some member states say that if the EU can share the cost of installing cameras, watchtowers and other infrastructure along the external border, it will free up national budgets and speed up the construction process.","But diplomats from a number of member states say that if the EU were to share the cost of installing cameras, observation towers and other infrastructure along the external border, it would free up national budgets and speed up construction.","But diplomats in some member states say that if the EU can share the installation of cameras, watchtowers and other infrastructure along external borders, it will free up national budgets to speed up the construction process.","But diplomats in some member states said if the EU shared the cost of installing cameras, watchtowers and other infrastructure along its external borders, it would free up national budgets and speed up the process.","But diplomats from some member states said that if the EU can share the cost of installing cameras, watchtowers and other infrastructure along its external borders, it will free up national budgets for countries to speed up the construction process.","But diplomats from some member states say that if the EU were to share the cost of installing cameras, watchtowers and other infrastructure along its external borders, it would free up national budgets to speed up the construction process.","But diplomatic officials from some member states say that if the EU were to share the portion of the installation of cameras, watchtowers and other infrastructure along the external borders, it would free up national budgets for countries to speed up the construction process.","However, diplomats from some member states say that if the EU can share the part of installing cameras, observation towers, and other infrastructure along the external border, this will free up national budgets for countries and thus speed up the construction process.","The installation of cameras, watchtowers, and other infrastructure along the EU's external borders would free up national funds and move along more quickly, according to diplomats in several member states.","But diplomats from some member states say that if the EU could share the cost of installing cameras, watchtowers, and other infrastructure along the external border, it would free up national budgets and thus speed up the construction process.","But diplomats in some member states said if the EU shared the cost of installing cameras, watchtowers and other infrastructure along its external borders, it would free up national budgets and speed up the process.","But diplomats from some member states say that if the EU shared the cost of installing cameras, watchtowers and other infrastructure along the external border, it would free up national budgets and speed up the construction process."
43,1451,"The question of the price is not really the most important, the key is how to replace a blank book on the kindle with a book with actual content, instead of downloading it forever.","The issue of price is not the most important, the key is how to replace the blank books on Kindle with books of actual content, rather than always downloading ""coming soon"".","1. The price issue is actually not the most important thing. The key is how to replace the blank books on the kindle with books with actual content, instead of downloading them forever and saying ""stay tuned""","1. The issue of price is not the most important, the key is now how to replace the blank book on the kindle with a book with actual content, rather than forever download is ""stay tuned""","1. The issue of price is not the most important thing, the key is how to replace the blank book on the Kindle with a book with actual content, instead of always downloading ""please look forward to it""","The price is not the most important issue, the key is how to replace the blank books on the Kindle with books with real content, instead of downloading them forever.","1. The price is not the most important thing, the key is now how to replace the blank books on the Kindle with books with real content, instead of downloading them forever.","1. The issue of price is not the most important, the key is how to replace the blank book on the Kindle with a book with actual content, instead of downloading it forever is ""stay tuned""","1. The issue of price is not the most important issue. The key is how to replace the blank books on Kindle with books with actual content, instead of downloading them forever and saying ""stay tuned""","1. The issue of price is actually not the most important. The key is how to replace blank books on kindle with books with actual content, rather than downloading them forever“ ""Stay tuned”","The question of price is not the most important, the key is now how to replace the blank book on Kindle with the actual content of the book, instead of forever downloading it is ""please look forward""","1. the price is not really the most important issue, the key is how to replace the blank books on kindle with books with actual content now, instead of downloading them forever with ""stay tuned"".","1. The price issue isn't actually the most important one; the key is how to replace the blank book on the Kindle with the actual content now, rather than the “stay tuned” if you download it forever","1. The price issue is not the most crucial one, the trick is to figure out how to swap out the empty books on Kindle with books that have actual substance rather than just downloading them indefinitely and saying ""stay tuned""","The issue of price is not the most important, the key is how to replace the blank books on Kindle with books of actual content, rather than always downloading ""coming soon"".","1. The price issue is actually not the most important thing. The key is how to replace the blank books on the kindle with books with actual content, instead of downloading them forever and saying ""stay tuned""","1. The issue of price is actually not the most important, the key is how to replace the blank book on the kindle with a book with actual content, instead of downloading it forever and saying ""stay tuned"" are all ""stay tuned""."
44,1958,"As a result, there are still many things that need to be done, and it is important to be careful when buying.","In conclusion, this product has many shortcomings, so please be cautious when purchasing.","To sum up, this product still has many deficiencies, and I hope you will be cautious when buying it.","To sum up, this product still has many shortcomings, I hope you should be careful when buying.","In summary, this product has many shortcomings, so please be careful when buying.","In summary, there are many shortcomings in this product, so please be careful when buying.","All in all, there are many deficiencies of this product, so please be careful when you buy.","To sum up, this product still has many shortcomings, I hope you should be cautious when buying.","To sum up, this product still has many deficiencies, and I hope you will be cautious when buying it.","In summary, there are still many shortcomings in this product. I hope you should be careful when buying it.","In summary, there are many shortcomings in this product, I hope everyone to be careful when buying.","To summarize, this product has many shortcomings and I hope you will be careful when buying it.","In summary, there are still many shortcomings in this product, so I hope everyone should be careful when buying it.","To summarize, this product still has numerous flaws, and I hope you would be cautious while purchasing it.","To summarize, this product still has numerous flaws, and I hope you would be cautious while purchasing it.","To sum up, this product still has many deficiencies, and I hope you will be cautious when buying it.","To sum up, this product still has many shortcomings. I hope you will be careful when buying it."
45,356,"In West, Central and North Africa, the opioid crisis was exacerbated by tramadol and in North America by fentanyl, two regions that had little in common in terms of economy, demographics or general patterns of drug use but were struggling to combat the opioid crisis fuelled by easily available and low-cost substances.","In West Africa, Central Africa, and North Africa, the opioid crisis is exacerbated by Tramadol; in North America, it is Fentanyl. These two regions have almost no commonalities in terms of economy, demographic data, or general drug use patterns, but both are struggling to combat the opioid crisis fueled by easily accessible and low-cost substances.","In West, Central and North Africa, it is tramadol that is fueling the opioid crisis; in North America it is fentanyl. The two regions, which have little in common in terms of economics, demographics or general drug use patterns, are struggling to combat an opioid crisis fueled by readily available and cheaply produced substances.","In West, Central and North Africa, it is tramadol that is exacerbating the opioid crisis; in North America, it is fentanyl. The two regions have little in common in terms of economics, demographics or general patterns of drug use, but both are struggling to combat an opioid crisis fuelled by substances that are easily available and cheap to produce.","In West Africa, Central Africa, and North Africa, the opioid crisis is exacerbated by Tramadol; in North America, it is Fentanyl. These two regions have little in common in terms of economy, demographic data, or general drug use patterns, but both are struggling to combat the opioid crisis fueled by easily accessible and low-cost substances.","In West, Central and North Africa, the opioid crisis is exacerbated by Kumamoto; in North America, it is Fentanyl. The two regions have little in common in terms of economics, demographics or general patterns of drug use, but are struggling to combat the opioid crisis fueled by the availability and low cost of the substance.","In West Africa, Central Africa and North Africa, Kumamoto is the acute opioid crisis; in North America, it is Fentanyl. The two regions have little in common in terms of economics, demographics or general patterns of drug use, but all are working hard to combat a opioid crisis fueled by the easy availability and low-cost production of the drug.","In West, Central and North Africa, it is tramadol that exacerbates the opioid crisis; In North America, it's fentanyl. The two regions have little in common economically, demographically, or general drug use patterns, but both struggle with the opioid crisis fuelled by readily available and low-cost substances.","In West, Central and North Africa, it is tramadol that is fueling the opioid crisis; in North America it is fentanyl. The two regions, which have little in common in terms of economics, demographics or general drug use patterns, are struggling to combat an opioid crisis fueled by readily available and cheaply produced substances.","In West Africa, Central Africa, and North Africa, tramadol is exacerbating the opioid crisis; in North America, it is fentanyl.The two regions have little in common in terms of economy, demographic statistics, or general drug abuse patterns, but they are both struggling to combat the opioid crisis driven by easily available and low-cost substances.","In West, Central and North Africa, the opioid crisis is exacerbated by tramadol; in North America, fentanyl.The two regions have little in common in terms of economics, demographics or general patterns of drug use, but both are struggling to fight the opioid crisis fuelled by substances that are readily available and cheap to produce.","In West, Central and North Africa, it is tramadol that fuels the opioid crisis; in North America, it is fentanyl. The two regions have little in common in terms of economies, demographics or general patterns of drug use, but both are struggling to combat the opioid crisis, which is fuelled by substances that are readily available and cheap to produce.","In West Africa, Central Africa, and North Africa, it is tramadol that is exacerbating the opioid crisis; in North America it is fentanyl. The two regions have little in common in terms of economies, demographics, or general drug use patterns, yet they are struggling to fight the opioid crisis fueled by substances that are easily available and low in production costs.","In West, Central and North Africa, it is tramadol that is fueling the opioid crisis; in North America it is fentanyl. The opioid problem is being exacerbated by easily accessible and inexpensively produced drugs in the two locations, which have little in common in terms of economics, demographics, or overall drug usage trends.","In West, Central and North Africa, it is tramadol that is fueling the opioid crisis; in North America it is fentanyl. The two regions, which have little in common in terms of economics, demographics or general drug use patterns, are struggling to combat an opioid crisis fueled by readily available and cheaply produced substances.","In West, Central and North Africa, it is tramadol that is fueling the opioid crisis; in North America it is fentanyl. The two regions, which have little in common in terms of economics, demographics or general drug use patterns, are struggling to combat an opioid crisis fueled by readily available and cheaply produced substances.","In West, Central and North Africa, the opioid crisis was exacerbated by tramadol. In North America it is fentanyl. The two regions have little in common in terms of economics, demographics, or general patterns of drug use, but both are struggling to combat an opioid crisis fueled by substances that are easily available and inexpensive to produce."
