id,Target_Index,ANVITA,GPT4-5shot,HW-TSC,IOL_Research,Lan-BridgeMT,NLLB_Greedy,NLLB_MBR_BLEU,ONLINE-A,ONLINE-B,ONLINE-G,ONLINE-M,ONLINE-W,ONLINE-Y,refA,synthetic_ref,Yishu,ZengHuiMT
56,1329,A box of compressed deformation.,Regarding a deformed box under pressure.,Just a deformed box.,Just a deformed box.,Just a deformed box.,The box is a deformed box.,It is a deformed box.,Just a press-deformed box.,Just a deformed box.,Just a deformed box.,It's a deformed suitcase.,Just a crushed and deformed box.,It's just a deformed case.,Just a box that is crumpled and distorted.,Just a deformed box.,Just a deformed box.,Just a deformed box.
57,598,"According to the financial affairs department of the Taiwan authorities, Taiwan's exports in January this year amounted to US $31.51 billion, a decrease of 21.2 per cent annually, marking the fifth consecutive month of negative growth.","According to the financial authorities in Taiwan, the region's exports in January of this year amounted to $31.51 billion, a year-on-year decrease of 21.2%, marking the fifth consecutive month of negative growth.","According to the financial affairs department of the Taiwan authorities, Taiwan's exports in January this year were 31.51 billion US dollars, an annual decrease of 21.2%, and it was the fifth consecutive month of negative growth.","Taiwan's exports fell 21.2 percent to $31.51 billion in January, the fifth consecutive month of negative growth, according to the Taiwan authorities' financial affairs department.","According to the financial affairs department of the Taiwan authorities, Taiwan's exports in January this year were 31.51 billion US dollars, a year-on-year decrease of 21.2%, and a negative growth for the fifth consecutive month.","Taiwan's exports in January were $31.51 billion, down 21.2% year-on-year, the fifth consecutive month of negative growth, according to the Taiwanese Ministry of Finance.","The Taiwanese region exported $31.51 billion (£37.3 million) in January, down 21.2% year-on-year, the fifth consecutive month of negative growth, according to the Ministry of Finance.","According to the financial affairs department of the Taiwan authorities, Taiwan's exports in January this year amounted to $31.51 billion, down 21.2 percent year-on-year, marking the fifth consecutive month of negative growth.","According to the financial affairs department of the Taiwan authorities, Taiwan's exports in January this year were 31.51 billion US dollars, an annual decrease of 21.2%, and it was the fifth consecutive month of negative growth.","According to the announcement by the competent financial affairs department of the Taiwan authorities, Taiwan's exports in January this year were US331.51 billion, a decrease of 21.2% year-on-year, the fifth consecutive month of negative growth.","According to the financial affairs department of the Taiwan authorities, Taiwan's exports in January this year of 31.1 billion U.S. dollars, a year-on-year decrease of 21.2%, the fifth consecutive month of negative growth.","According to the Taiwan authorities in charge of financial affairs announced that Taiwan's exports in January this year, 31.51 billion U.S. dollars, an annual decrease of 21.2%, the fifth consecutive month of negative growth.","According to an announcement from the financial affairs department of the Taiwan authorities, Taiwan exported 31.51 billion US dollars in January this year, a decrease of 21.2% per year, for the 5th consecutive month of negative growth.","Concurring to the monetary undertakings office of the Taiwan specialists, Taiwan's trades in January this year were 31.51 billion US dollars, an yearly diminish of 21.2%, and it was the fifth continuous month of negative development.","According to the financial affairs department of the Taiwan authorities, Taiwan's exports in January this year amounted to US $31.51 billion, a decrease of 21.2 per cent annually, marking the fifth consecutive month of negative growth.","According to the financial affairs department of the Taiwan authorities, Taiwan's exports in January this year were 31.51 billion US dollars, an annual decrease of 21.2%, and it was the fifth consecutive month of negative growth.","According to the financial affairs department of the Taiwan authorities, Taiwan's export 315 in January this year was announced. At $100 million, it dropped by 21 per year. Of two percent, there was the fifth consecutive month of negative growth for the second year."
58,1919,Upon receipt of the goods:,"Upon receiving the goods, it was found that:","After receiving the goods, inspection found:","After receiving the goods, the inspection found that:","Upon inspection after receiving the goods, it was found that:",The inspection found:,"Upon receipt, the inspection found that:","After receiving the goods, the inspection found:","After receiving the goods, inspection found:","After receiving the goods, the inspection found that：","Upon receipt of the goods, the inspection found:","Upon receiving the shipment and inspecting it, I found:","After receiving the goods, the inspection revealed:","After receiving the products, investigation showed that:","Upon receiving the shipment and inspecting it, I found:","After receiving the goods, inspection found:","After receiving the goods, the inspection found that they had been found."
59,1767,"I don't understand why Amazon sends EMS, which is widely accepted in the industry. Well, computers are valuable, too!","I don't understand why Amazon would choose to ship with EMS, which is widely recognized in the industry as unreliable. After all, a computer is a valuable item!","I don't understand why Amazon wants to send EMS. It is recognized in the industry as unreliable. Well, computers are valuables anyway!","Do not understand why Amazon to send EMS, the industry is recognized as unreliable, well, the computer is also valuable ah!","I don't understand why Amazon would use EMS, which is widely recognized as unreliable in the industry. After all, a computer is a valuable item!","I don't know why Amazon sends EMS, which is not trustworthy in the industry, well, computers are also valuable items!","I don't understand why Amazon wants to send EMS, which is not trustworthy in the industry, well, good computers are valuable goods too!","I don't understand why Amazon sends EMS, the industry is recognized as unreliable, well, computers are also valuables!","I don’t understand why Amazon wants to send EMS. It is recognized in the industry as unreliable. Well, computers are valuables anyway!","I don't understand why Amazon wants to send EMS. It is recognized in the industry as unreliable. Well, computers are valuables anyway!","Do not understand why Amazon to send EMS, the industry is recognized as unreliable, well, the computer is also a valuable item!","I don't understand why Amazon wants to send EMS, which is recognized as unreliable in the industry, well, computers are at least valuables!","I don't understand why Amazon sends EMS; the industry admits that it's unreliable. OK, computers are also valuable items!","Why Amazon wants to dispatch EMS is a mystery to me, its unreliability is acknowledged in the sector, computers are, in any case, valuable!","I don't understand why Amazon would choose to ship with EMS, which is widely recognized in the industry as unreliable. After all, a computer is a valuable item!","I don’t understand why Amazon wants to send EMS. It is recognized in the industry as unreliable. Well, computers are valuables anyway!","I don't understand why Amazon wants to send EMS, which is recognized by the industry as unreliable. Well, computers are also valuable items anyway."
60,595,Taiwan's economy underperformed in the first year of recession - CNN.com,"Multiple data declines, Taiwan's economy starts the year poorly - China News Network.","A number of data recession, Taiwan's economy performed poorly in the beginning of the year - Chinanews.com",Taiwan's economy started the year poorly - ECNS,"Multiple Data Decline, Taiwan's Economy Starts the Year Poorly - China News Network",Taiwan's economy starts off badly - China News Network,Multiple data recession Taiwan economy starts year off badly - Xinhua,A number of data recession Taiwan's economy began the year with poor performance-Chinanews.com,Taiwan's economy performed poorly in the beginning of the year due to a number of data recessions - Xinhua English.news.cn,A number of data show that Taiwan's economy performed poorly in the first year of the recession- <url>,"Multiple data recessions, Taiwan's economy performs poorly at the beginning of the year",Multiple data recession Taiwan's economy starts year off poorly - CNN.com,"Multiple data decline, Taiwan's economy did not perform well at the beginning of the year.-Sinomine.com","Agreeing to a number of information focuses, Taiwan's economy did ineffectively within the begin of the year","A number of data recession, Taiwan's economy performed poorly in the beginning of the year - Chinanews.com",Taiwan's economy performed poorly in the beginning of the year due to a number of data recessions-Chinanews.com,Taiwan's economy performed poorly in the beginning of the year due to a number of data recessions - China News Network ( Xinhua) .
61,1149,Strengthening restrictions on technology exports to China,Strengthen restrictions on technology exports to China.,Strengthen restrictions on technology exports to China,Tightening restrictions on technology exports to China,Strengthening restrictions on technology exports to China,Restrictions on technology exports to China,Increasing restrictions on technology exports to China,Strengthen restrictions on technology exports to China,Strengthen restrictions on technology exports to China,Strengthen restrictions on technology exports to China,Restricting the export of technology to China,Increased restrictions on technology exports to China,Strengthening restrictions on technology exports to China,Increased restrictions on technology exports to China,Strengthen restrictions on technology exports to China,Strengthen restrictions on technology exports to China,Strengthen restrictions on technology exports to China.
62,978,"A: On February 3, the US Department of Labor released data on non-farm employment for January 2023, adding 517,000 new non-farm jobs, significantly exceeding market expectations by 189,000. The unemployment rate fell to 3.4%, the lowest level in nearly 50 years.","On February 3rd, the U.S. Department of Labor announced the non-farm employment data for January 2023, with an increase of 517,000 non-farm jobs, significantly higher than the market expectation of 189,000; the unemployment rate dropped to 3.4%, the lowest in nearly 50 years; the year-on-year wage growth was 4.4%, and the month-on-month growth was 0.3%, slightly slowing down.","A: On February 3, the U.S. Department of Labor announced the non-agricultural employment data for January 2023. New non-agricultural employment was 517,000, much higher than the market expectation of 189,000; the unemployment rate fell to 3.4%, the lowest level in the past 50 years; hourly wages increased by 4.4% year-on-year and 0.3% month-on-month, a slight slowdown.","A: On February 3, the U.S. Department of Labor released non-farm payrolls data for January 2023, adding 517,000 non-farm payrolls, significantly higher than market expectations of 189,000; the unemployment rate fell to 3.4%, the lowest in nearly 50 years; and hourly wages grew by 4.4% year-on-year and 0.3% month-on-month, slowing slightly.","A: On February 3, the US Department of Labor announced the non-farm employment data for January 2023, with an increase of 517,000 non-farm jobs, significantly higher than the market expectation of 189,000; the unemployment rate fell to 3.4%, the lowest in nearly 50 years; hourly wages increased by 4.4% year-on-year and 0.3% month-on-month, slightly slowing down.","A: January 3, 2023 nonfarm employment data released by the U.S. Department of Labor, adding 517,000 nonfarm jobs, significantly higher than the market expectation of 189,000; unemployment rate dropped to 3.4%, the lowest level in nearly 50 years; hourly wage growth was 4.4%, year-over-year growth was 0.3%, slightly slower.","A: January 3, 2021 U.S. Department of Labor nonfarm employment data for January 2023; 5.17,000 new nonfarm jobs, significantly above the 189,000 market expectation; unemployment rate decreased to 3.4%, the lowest level in almost 50 years; hourly wage growth 4.4%, compound annual growth 0.3%, slightly slower.","A: On February 3, the US Department of Labor released non-farm payrolls data for January 2023, adding 517,000 non-farm payrolls, significantly higher than market expectations of 189,000; the unemployment rate fell to 3.4%, the lowest level in nearly 50 years; Hourly earnings grew 4.4% year-over-year and 0.3% month-on-month, slowing slightly.","A: On February 3, the U.S. Department of Labor announced the non-agricultural employment data for January 2023. New non-agricultural employment was 517,000, which was much higher than the market expectation of 189,000; the unemployment rate fell to 3.4%, the highest level in the past 50 years. The lowest level; hourly wages increased by 4.4% year-on-year and 0.3% month-on-month, a slight slowdown.","A: On February 3, the U.S. Department of Labor released non-farm payrolls data for January 2023, with 517,000 new non-farm payrolls, which was significantly higher than the 189,000 expected by the market; the unemployment rate fell to 3.4%, the lowest level in nearly 50 years; hourly wages grew by 4.4% year-on-year, and the growth rate was 0.3% sequentially, a slight slowdown.","A: On February 3, the U.S. Department of Labor released non-farm employment data in January 2023, adding 517,000 new non-farm employment, significantly higher than the market expectation of 189,000 people; the unemployment rate fell to 3.4%, the lowest in nearly 50 years; hourly wage growth rate of 4.4%, the growth rate of 0.3%, slowing slightly.","A: On February 3, the U.S. Department of Labor released January 2023 nonfarm payrolls data, adding 517,000 nonfarm payrolls, sharply higher than the market expectation of 189,000; the unemployment rate fell to 3.4%, the lowest in nearly 50 years; hourly wages grew at a rate of 4.4% year-on-year, and at a slightly slower rate of 0.3% year-on-year.","A: On February 3, the US Department of Labor released non-farm payrolls data for January 2023, adding 517,000 new non-farm payrolls, significantly higher than market expectations of 189,000; the unemployment rate fell to 3.4%, the lowest level in nearly 50 years; hourly wages grew 4.4% year on year and 0.3% month on month, a slight slowdown.","A: On February 3, the U.S. Department of Labor released January 2023 nonfarm payrolls data, adding 517,000 new nonfarm jobs, significantly higher than market expectations of 189,000; the unemployment rate fell to 3.4%, the lowest in nearly 50 years; hourly earnings grew at a slightly slower rate of 4.4% year-over-year and 0.3% year-over-year.","A: On February 3, the US Department of Labor released non-farm payrolls data for January 2023, adding 517,000 new non-farm payrolls, significantly higher than market expectations of 189,000; the unemployment rate fell to 3.4%, the lowest level in nearly 50 years; hourly wages grew 4.4% year on year and 0.3% month on month, a slight slowdown.","A: On February 3, the U.S. Department of Labor announced the non-agricultural employment data for January 2023. New non-agricultural employment was 517,000, which was much higher than the market expectation of 189,000; the unemployment rate fell to 3.4%, the highest level in the past 50 years; hourly wages increased by 4.4% year-on-year and 0.3% month-on-month, a slight slowdown.","A On February 3, the U.S. Department of Labor released non-farm employment data for January 2023, adding non-farm employment to 51 new non-farm employment. At 70, 000, it was significantly higher than the market expectations of the 18th. 90, 000 people. Unemployment fell to 3 percent. Fourteen percent - the lowest level in nearly 50 years. Hourly earnings are increasing at a year-on-year rate of 4 per hour. It is up to 4 percent and up to 0 percent. 3, that's slightly slow down."
63,900,Xi Jinping Exhorts Members of China-Africa Medical Corps to Benefit Local People with Practical Actions to Tell Chinese Stories,"Xi Jinping replied to a letter encouraging the Chinese medical team aiding Central Africa to benefit the local people with benevolence and medical skills, and to tell the story of China through practical actions.","Xi Jinping wrote back to encourage the members of the Chinese medical team to aid China and Africa to benefit the local people with benevolence and benevolence, and to tell Chinese stories well with practical actions",Xi Jinping wrote back to encourage the members of the Chinese medical team in Central Africa to benefit the local people with benevolence and benevolence and tell China's story well with practical actions,Xi Jinping replies to encourage members of the China-Africa medical team to benefit the local people with benevolence and practical actions to tell the Chinese story,Xi Jinping encourages medical team members to speak up for China by doing good deeds to benefit the local people,"In reply, Xi Jinping urged the Chinese medical team members in China to share China's story with concrete actions for the benefit of the local people through kindness and generosity","Xi Jinping replied to the letter and encouraged the members of the Chinese medical team to aid China and Africa to benefit the local people with benevolence and benevolence, and tell China's story well with practical actions","Xi Jinping wrote back to encourage the members of the Chinese medical team to aid China and Africa to benefit the local people with their benevolence and benevolence, and to tell the Chinese story well with practical actions","Xi Jinping wrote back and encouraged the members of the Chinese medical team to aid Central Africa to benefit the local people with benevolence and benevolence, and to tell a good Chinese story with practical actions.",Xi Jinping wrote back to encourage members of the China-Africa Chinese medical team to benefit the local people with compassion and practical actions to tell the Chinese story.,"Xi Jinping writes back to encourage members of China's medical team in China-Africa to benefit local people with their kind hearts and skills, and to tell China's story with practical actions.",Xi Jinping wrote back encouraging the members of the Chinese medical aid team to use kindness and benevolence to benefit the local people and tell the Chinese story well through practical actions,Xi Jinping wrote back to encourage China's medical team members to benefit local people with their benevolent hearts and skills and tell the Chinese story with practical actions,Xi Jinping wrote back to encourage China's medical team members to benefit local people with their benevolent hearts and skills and tell the Chinese story with practical actions,"Xi Jinping wrote back to encourage the members of the Chinese medical team to aid China and Africa to benefit the local people with their benevolence and benevolence, and to tell the Chinese story well with practical actions","Xi Jinping wrote back to encourage the members of the Chinese medical team to aid China and Africa to benefit the local people with benevolence and benevolence, and to tell the Chinese story well with practical actions."
64,1914,"Production of rotten goods, sale of rotten goods, resulting in rotten goods service, purchase of six watches to send the child, one of the quick numbers is incomplete, the time of the six pieces is inconsistent, ranging from ten to ten hours.","Producing poor quality goods, selling poor quality goods, resulting in poor service. I bought six watches to give to my children, one of which has an incomplete digital display, and the time on all six watches is inconsistent, varying by several hours.","Production of bad goods, sale of bad goods, the result of bad goods service, bought six watches to give to the children, one of them showed incomplete numbers, and the time of the six watches was not consistent, with a difference of more than ten hours.","Production of rotten goods, the sale of rotten goods, the result of rotten goods service, bought six watches to send children, one of the fast digital display is not complete, six pieces of time are inconsistent, the difference between ten hours.","Manufacturing junk, selling junk, resulting in junk service. I bought six watches to give to my children, one of which has an incomplete digital display. The time on all six watches is inconsistent, differing by several hours.","Producing bad goods, selling bad goods, and then selling bad goods, buying six watches to send to the kids, one of which shows incomplete numbers, and the six watches are not consistent, with a difference of ten hours.","Produced bad, sold bad, and the result was the service of bad, bought six watches to send to his children, one of them displayed incomplete numbers, six hours of time were inconsistent, ten hours apart.","Produce rotten goods, sell rotten goods, and as a result of rotten goods service, buy six watches to send to children, one of the fast numbers is not completely displayed, the time of the six pieces is inconsistent, the difference of more than ten hours.","Production of bad goods, sale of bad goods, the result of bad goods service, bought six watches to give to the children, one of them showed incomplete numbers, and the time of the six watches was not consistent, with a difference of more than ten hours.","Producing rotten goods and selling rotten goods, as a result of the rotten goods service, I bought six watches for my children. One of the numbers showed incomplete, and the time of the six pieces was inconsistent, with a difference of more than ten hours.","Producing rotten goods, selling rotten goods, resulting in rotten goods service, bought six watches to send children, of which a quick figure shows incomplete, six pieces of time are inconsistent, the difference is more than ten hours.","Produces crappy products, sells crappy products, results in crappy service, bought six watches for my kids, one of them has an incomplete digital display of the fastest, and all six are inconsistent with the time, ranging from a dozen or so hours apart.","They produced bad goods and sold bad goods. As a result, the bad goods service bought six watches to send to children. The quick numbers on the first one were not fully displayed; the time for the six yuan was not consistent; the difference ranged from about ten hours.","This was the outcome of the production of defective goods, sale of defective goods, and service of defective goods, six timepieces were purchased to be given to the children, but one of them showed partial numerals, and the time on all six watches varied by more than ten hours.","Producing poor quality goods, selling poor quality goods, resulting in poor service. I bought six watches to give to my children, one of which has an incomplete digital display, and the time on all six watches is inconsistent, varying by several hours.","Produced bad goods, sold bad goods, turned out to be bad goods service, bought six watches to give to children, one of them showed incomplete numbers, and the time of the six watches was not consistent, with a difference of more than ten hours.","Production of rotten goods, sale of rotten goods, the result of rotten goods service, bought six watches to give to children, one of the fast figures is not completely displayed, six pieces of time are inconsistent, the difference varies from more than ten hours to more than ten hours."
65,1292,"There is no need to buy a card, buy one yourself, or buy a cell phone from Amazon.","The downside is that it doesn't come with a card, I had to buy it myself, and I have previously bought a phone on Amazon.","The disadvantage is that there is no card, I bought it myself, and I bought a mobile phone from Amazon before.","The shortcoming is that there is no card, I bought it myself, and I bought the phone on Amazon before.","The only drawback is that there is no card, I bought it myself, and I have bought a mobile phone on Amazon before.","It's not enough to have no card, buy it yourself, or buy a phone from Amazon before.","I don't think it's enough to have a card, to buy it myself, and to have bought a mobile phone on Amazon.","The disadvantage is that there is no card, I bought it myself, and I have bought a mobile phone on Amazon before.","The disadvantage is that there is no card, I bought it myself, and I bought a mobile phone from Amazon before.","The disadvantage is that I don't have a card, I bought it myself, and I have bought a mobile phone on Amazon before.","It’s not enough to have a card, buy it yourself, and have previously bought a phone on Amazon.","The downside is that it doesn't have a card, I bought it myself, and the fact that I've bought cell phones from Amazon before.","The downside is that I don't have a card; I bought one myself, and I've bought a cell phone on Amazon before.",The drawback is that there is no card; I paid for it out of pocket and previously purchased a phone from Amazon.,"The disadvantage is that there is no card, I bought it myself, and I bought a mobile phone from Amazon before.","The disadvantage is that there is no card, I bought it myself, and I bought a mobile phone from Amazon before.","The disadvantage is that I don't have a card, I bought it myself, and I have bought a mobile phone from Amazon before."
